{
  "$schema": "mainline-release-prerequisites.schema.json",
  "schema_version": 2,
  "contract_schema": "urn:python-udf-jit:mainline-release-prerequisites:v1",
  "profile": "mainline-production",
  "support_matrix": "mainline-support-matrix.json",
  "support_matrix_sha256": "045cdfc83bb868edd6086e32d6bc293b5d6a75e8bc64255c70e11a923b548628",
  "unit_completion_values": ["incomplete", "complete"],
  "gate_outcome_values": ["pass", "fail", "stop", "inconclusive"],
  "performance_policy": {
    "target_speedup": 1.15,
    "default_mode": "directional",
    "target_applies_to": "formal_only",
    "blocks_functional_completion": false,
    "below_target_disposition": "record_non_blocking_result"
  },
  "performance_baseline": {
    "mode": "directional",
    "workload": "tpch_sf10_lineitem_scalar_q6",
    "approximate_rows": 60000000,
    "baseline": {
      "mode": "off",
      "execution": "original_daft_scalar_udf"
    },
    "candidate": {
      "mode": "auto",
      "enabled_rfcs": [
        "RFC-001",
        "RFC-002",
        "RFC-003",
        "RFC-004",
        "RFC-005",
        "RFC-006",
        "RFC-007",
        "RFC-008"
      ],
      "disabled_rfcs": ["RFC-009", "RFC-010", "RFC-011", "RFC-012"]
    },
    "environment_constraint": "same_environment",
    "off_runs": 1,
    "auto_runs": 1,
    "conclusion_scope": "directional_only",
    "correctness": "ordered_result_and_aggregate_hash_equal",
    "blocks_functional_completion": false
  },
  "formal_performance_qualification": {
    "mode": "formal",
    "cli_flag": "--formal",
    "warmup_runs": 1,
    "alternating_measured_runs": 5,
    "statistic": "median",
    "stability_metrics": ["mad", "drift"],
    "target_speedup": 1.15,
    "fallback_minimum_ratio": 0.98,
    "blocks_functional_completion": false
  },
  "disabled_rfcs": ["RFC-009", "RFC-010", "RFC-011", "RFC-012"],
  "test_suites": {
    "unit": {
      "gate_id": "python.unit",
      "tier": "unit",
      "arguments": ["discover", "-s", "tests/unit", "-v"],
      "required_tests": [
        "test_scalar_and_mainline_profiles_load_independently",
        "test_every_required_suite_method_exists_in_selected_sources",
        "test_resolution_priority_is_disable_plugin_mode_compatibility_policy",
        "test_poor_performance_does_not_fail_functional_completion",
        "test_cross_code_object_state_preserves_null_alias_and_exception",
        "test_missing_gate_evidence_is_absent_not_inconclusive",
        "test_named_profiles_and_explicit_json_paths_resolve",
        "test_receipt_rejects_exact_count_drift_from_profile",
        "test_validator_rejects_environment_phase_and_performance_tampering",
        "test_formal_self_check_accepts_milestone_scope_without_claiming_release",
        "test_capture_is_deferred_until_operation_schema_is_available",
        "test_where_select_and_with_columns_finalize_each_candidate_once",
        "test_deserialization_rejects_missing_or_unsupported_versions",
        "test_installs_packaged_pth_at_explicit_purelib_root_idempotently",
        "test_rejects_an_unsupported_runtime_format_before_decoding",
        "test_normalizes_required_opcode_families_without_source_values",
        "test_decodes_exception_and_location_tables_with_complete_coverage",
        "test_canonical_encoding_round_trips_and_is_cross_process_stable",
        "test_rejects_corrupt_location_and_exception_tables",
        "test_local_join_builds_control_edges_and_local_phi",
        "test_short_circuit_builds_stack_phi",
        "test_verifier_rejects_each_structural_layer",
        "test_straight_line_numeric_function_needs_no_python_region",
        "test_opaque_call_forms_side_effect_region_with_exact_resume",
        "test_controlled_calls_and_readonly_aggregates_stay_python_regions",
        "test_exception_regions_retain_handler_state",
        "test_small_function_is_modeled_but_remains_a_python_region",
        "test_analysis_never_executes_the_user_function",
        "test_program_encoding_round_trips_without_source_or_names",
        "test_two_opaque_calls_have_stable_nonoverlapping_regions",
        "test_verifier_rejects_resume_live_and_coverage_corruption",
        "test_static_capture_does_not_change_cpython_results",
        "test_code_and_dependencies_are_separate",
        "test_global_and_default_changes_only_dependency_fingerprint",
        "test_opaque_dependency_rejects_without_repr_or_address",
        "test_identity_is_cross_process_stable",
      "test_capture_cache_is_job_scoped_ttl_and_lru_bounded",
      "test_semantic_literals_round_trip_without_repr_or_address",
      "test_multitype_semantic_module_round_trips_and_matches_cpython",
      "test_scalar_f64_capture_enters_the_semantic_pipeline",
      "test_non_jit_types_never_claim_a_cinderx_region",
      "test_all_required_analyses_are_value_free_and_hash_bound",
      "test_cached_analysis_is_reused_and_unpreserved_proof_recomputes",
      "test_incorrect_preserved_analysis_is_rejected_as_stale",
      "test_node_iteration_and_time_budgets_return_no_partial_regions",
      "test_pure_f64_chain_forms_one_verified_cinderx_candidate",
      "test_may_raise_operations_preserve_exception_order_edges",
      "test_python_region_is_an_exact_once_continuation_barrier",
      "test_verified_resume_executes_only_the_unfinished_suffix",
      "test_resume_rejects_control_flow_that_can_reenter_prefix",
      "test_keepalive_dominates_resume_and_suffix_is_claimed_exactly_once",
      "test_cinderx_deopt_can_only_recover_the_region",
      "test_incomplete_proof_selects_whole_function_before_region_execution",
      "test_live_value_shape_kind_and_materialization_are_fail_closed",
      "test_stale_continuation_abi_is_rejected_before_resume",
      "test_cinderx_payload_is_bound_to_contract_and_commit_boundary",
      "test_control_flow_and_effect_boundaries_never_merge",
      "test_multiple_effects_receive_explicit_order_edges",
      "test_semantic_verifier_rejects_exception_cfg_and_python_region_drift",
      "test_rfc003_unit_contract",
      "test_any_other_major_or_minor_is_rejected",
      "test_unknown_section_is_rejected_without_forward_compatibility",
      "test_unknown_manifest_field_is_rejected",
      "test_1_10_100_1000_artifacts_parse_once_per_content",
      "test_dependency_rejection_falls_back_once_before_provider_entry",
      "test_large_artifact_uses_ray_object_ref_when_driver_is_initialized",
      "test_default_install_requires_exact_objectref_bridge",
      "test_bridge_awaits_on_actor_loop_and_prefetches_for_sync_udf",
      "test_driver_references_relay_through_scheduler_and_clear_on_completion",
      "test_bridge_rejects_contract_mismatch_and_partial_state",
      "test_sync_actor_thread_rejects_unprefetched_ref_without_ray_get",
      "test_only_exact_formal_component_contract_is_admitted",
      "test_rfc004_unit_contract",
      "test_five_scalar_types_have_stable_address_free_fingerprints",
      "test_scalar_value_bounds_nullability_and_float32_rounding",
      "test_vector_batch_and_unknown_layouts_are_stably_rejected",
      "test_all_types_and_nulls_publish_atomically_with_value_free_metrics",
      "test_failed_output_is_aborted_and_never_exposes_partial_value",
      "test_concurrent_frames_are_isolated_and_old_process_is_rejected",
      "test_rfc005_unit_contract",
      "test_five_scalar_types_execute_through_typed_input_and_output_slots",
      "test_five_scalar_types_roundtrip_through_formal_artifact_layout",
      "test_nullable_matrix_preserves_null_without_loading_a_value",
      "test_local_branch_and_comparison_publish_exactly_one_result",
      "test_layout_and_semantic_type_mismatch_is_rejected_before_compile",
      "test_rfc006_unit_contract"
      ],
      "expected_test_count": 268,
      "allow_skips": false
    },
    "integration": {
      "gate_id": "python.integration",
      "tier": "integration",
      "arguments": ["discover", "-s", "tests/integration", "-t", ".", "-v"],
      "required_tests": [
        "test_support_matrix_and_acceptance_profile_agree",
        "test_runtime_baselines_separate_target_from_current_validation",
        "test_trusted_job_contract_uses_hash_and_worker_revalidation",
        "test_only_physical_multinode_is_an_external_release_prerequisite",
        "test_counterexample_matrix_resumes_suffix_exactly_once",
      "test_native_payload_crosses_exactly_once_into_python_suffix",
        "test_real_where_select_with_columns_preserve_options_and_scalar_semantics",
        "test_off_and_observe_match_without_repeating_side_effects",
        "test_off_and_observe_preserve_real_daft_exception_semantics",
        "test_explicit_pth_bootstrap_hooks_fresh_driver_and_worker_interpreters",
      "test_scalar_call_view_is_address_free_and_stable_across_worker_pickle",
      "test_driver_frontend_round_trips_in_fresh_worker_process",
      "test_rfc003_integration_contract",
      "test_object_ref_survives_framework_pickle_and_rebuilds_after_restart",
      "test_lost_object_is_negative_cached_without_cross_job_reuse",
      "test_driver_worker_mismatch_rejects_before_resource_qualification",
      "test_rfc004_integration_contract",
      "test_five_scalar_layouts_materialize_in_a_fresh_worker_process",
      "test_rfc005_integration_contract",
      "test_both_workers_execute_full_cinderx_scalar_matrix",
      "test_rfc006_integration_contract"
      ],
      "expected_test_count": 54,
      "allow_skips": false
    },
    "live": {
      "gate_id": "python.live",
      "tier": "system",
      "arguments": [
      "tests.e2e.test_scalar_mainline_piercing",
      "tests.integration.test_per_worker_artifact_qualification",
      "tests.e2e.test_mainline_production",
      "-v"
      ],
      "required_tests": [
        "test_live_evidence_is_supplied_by_the_external_harness",
        "test_same_production_plan_compiles_and_executes_on_each_worker",
      "test_rfc002_frontend_verifies_on_each_worker",